{
  "_meta": {
    "version": "1.0.0",
    "last_updated": "2026-03-31T00:00:00.000Z",
    "total_articles": 12
  },
  "industries": [
    {
      "id": "construction",
      "name_ja": "建設業",
      "name_en": "Construction",
      "color": "#E67E22"
    },
    {
      "id": "real_estate",
      "name_ja": "不動産",
      "name_en": "Real Estate",
      "color": "#2ECC71"
    },
    {
      "id": "manufacturing",
      "name_ja": "製造業",
      "name_en": "Manufacturing",
      "color": "#3498DB"
    },
    {
      "id": "ai",
      "name_ja": "AI",
      "name_en": "Artificial Intelligence",
      "color": "#9B59B6"
    },
    {
      "id": "consulting",
      "name_ja": "コンサルティング",
      "name_en": "Consulting",
      "color": "#1ABC9C"
    }
  ],
  "theme_tags": [
    { "id": "dx", "label_ja": "DX・デジタル変革", "label_en": "Digital Transformation" },
    { "id": "labor_shortage", "label_ja": "人手不足・働き方改革", "label_en": "Labor Shortage & Work Reform" },
    { "id": "regulation", "label_ja": "法規制・制度変更", "label_en": "Regulation & Policy" },
    { "id": "sustainability", "label_ja": "サステナビリティ・ESG", "label_en": "Sustainability & ESG" },
    { "id": "ma", "label_ja": "M&A・業界再編", "label_en": "M&A & Industry Restructuring" },
    { "id": "global", "label_ja": "グローバル展開", "label_en": "Global Expansion" },
    { "id": "automation", "label_ja": "自動化・省人化", "label_en": "Automation" },
    { "id": "cost", "label_ja": "コスト・資材価格", "label_en": "Cost & Material Prices" },
    { "id": "startup", "label_ja": "スタートアップ・新規参入", "label_en": "Startups & New Entrants" },
    { "id": "generative_ai", "label_ja": "生成AI活用", "label_en": "Generative AI Adoption" },
    { "id": "data_platform", "label_ja": "データ基盤・プラットフォーム", "label_en": "Data Platform" },
    { "id": "supply_chain", "label_ja": "サプライチェーン", "label_en": "Supply Chain" },
    { "id": "skills_talent", "label_ja": "人材・スキル", "label_en": "Skills & Talent" },
    { "id": "investment", "label_ja": "投資・資金調達", "label_en": "Investment & Funding" }
  ],
  "articles": [
    {
      "id": "NEWS-0001",
      "title": "大手ゼネコン5社、AI施工管理プラットフォームを共同開発へ",
      "source_name": "日経クロステック",
      "published_at": "2026-03-28",
      "collected_at": "2026-03-28T09:00:00.000Z",
      "industries": ["construction", "ai"],
      "theme_tags": ["dx", "automation", "generative_ai"],
      "summary": "大手ゼネコン5社がAIを活用した施工管理プラットフォームの共同開発に合意。現場写真からの進捗自動判定、安全パトロールのAI支援、日報自動生成などを2027年実用化目標。",
      "key_facts": ["5社共同", "2027年実用化", "AI施工管理"],
      "business_insight": "建設業のAI活用が個社の実験段階から業界標準化フェーズに移行。プラットフォーム化により中小建設会社への波及効果が期待される。",
      "sentiment": "positive",
      "impact_level": "high",
      "status": "analyzed"
    },
    {
      "id": "NEWS-0002",
      "title": "不動産テック市場、2026年度は前年比35%成長予測",
      "source_name": "不動産経済新聞",
      "published_at": "2026-03-25",
      "collected_at": "2026-03-25T10:30:00.000Z",
      "industries": ["real_estate", "ai"],
      "theme_tags": ["dx", "investment", "generative_ai"],
      "summary": "不動産テック市場が急拡大。AIによる物件査定・VR内覧・スマートビル管理が3本柱。特に生成AIを使った物件説明文自動生成と顧客マッチングが伸長。",
      "key_facts": ["前年比35%成長", "生成AI物件マッチング", "VR内覧"],
      "business_insight": "不動産×AIは査定・内覧・管理の3領域で同時進行。建設業のBIM連携が次の成長ドライバーになる可能性。",
      "sentiment": "positive",
      "impact_level": "high",
      "status": "insight_added"
    },
    {
      "id": "NEWS-0003",
      "title": "建設業の2024年問題、残業規制後の現場混乱が深刻化",
      "source_name": "建設通信新聞",
      "published_at": "2026-03-20",
      "collected_at": "2026-03-20T08:00:00.000Z",
      "industries": ["construction"],
      "theme_tags": ["regulation", "labor_shortage"],
      "summary": "時間外労働上限規制の適用開始から2年が経過。工期遅延・人材確保困難・下請けへのしわ寄せが顕在化。特に地方中小では深刻。",
      "key_facts": ["規制適用2年", "工期遅延増加", "地方中小で深刻"],
      "sentiment": "negative",
      "impact_level": "high",
      "status": "analyzed"
    },
    {
      "id": "NEWS-0004",
      "title": "製造業DX、現場のデータ活用率は依然15%未満",
      "source_name": "日刊工業新聞",
      "published_at": "2026-03-22",
      "collected_at": "2026-03-22T11:00:00.000Z",
      "industries": ["manufacturing"],
      "theme_tags": ["dx", "data_platform"],
      "summary": "経産省調査で製造業の現場データ活用率が15%未満に留まることが判明。センサーデータは収集できても分析・活用の人材とツールが不足。",
      "key_facts": ["データ活用率15%未満", "人材不足", "経産省調査"],
      "business_insight": "製造業のDXボトルネックは技術ではなく人材と組織文化。コンサルティング需要の拡大余地が大きい。",
      "sentiment": "negative",
      "impact_level": "medium",
      "status": "insight_added"
    },
    {
      "id": "NEWS-0005",
      "title": "コンサル大手4社、生成AI専門部隊を100人規模に拡大",
      "source_name": "日本経済新聞",
      "published_at": "2026-03-26",
      "collected_at": "2026-03-26T07:00:00.000Z",
      "industries": ["consulting", "ai"],
      "theme_tags": ["generative_ai", "skills_talent", "investment"],
      "summary": "デロイト・PwC・EY・KPMGの大手4社が生成AI専門チームを各100人規模に拡充。製造業・建設業向けの業界特化型AI導入支援が主戦場に。",
      "key_facts": ["4社各100人規模", "業界特化型AI支援", "製造業・建設業向け"],
      "business_insight": "大手コンサルがAI人材を囲い込む動き。中小コンサルは業界深堀り×AI実装力で差別化する必要がある。",
      "sentiment": "positive",
      "impact_level": "high",
      "status": "insight_added"
    },
    {
      "id": "NEWS-0006",
      "title": "建設資材価格、2026年Q1は前年比+12%で高止まり",
      "source_name": "建設物価調査会",
      "published_at": "2026-03-18",
      "collected_at": "2026-03-18T14:00:00.000Z",
      "industries": ["construction"],
      "theme_tags": ["cost", "supply_chain"],
      "summary": "鉄鋼・セメント・木材の主要3資材が引き続き高値。円安と物流コスト上昇が主因。公共工事の予定価格との乖離が拡大。",
      "key_facts": ["前年比+12%", "鉄鋼・セメント・木材", "予定価格乖離拡大"],
      "sentiment": "negative",
      "impact_level": "high",
      "status": "analyzed"
    },
    {
      "id": "NEWS-0007",
      "title": "AI×不動産管理、ビルメンテナンスの予知保全が本格化",
      "source_name": "日経不動産マーケット情報",
      "published_at": "2026-03-27",
      "collected_at": "2026-03-27T10:00:00.000Z",
      "industries": ["real_estate", "ai", "manufacturing"],
      "theme_tags": ["automation", "generative_ai", "data_platform"],
      "summary": "AIによるビル設備の予知保全サービスが相次ぎ登場。IoTセンサーと生成AIの組み合わせで、故障予測精度が従来比40%向上。製造業の予知保全ノウハウが不動産に転用される動き。",
      "key_facts": ["故障予測精度40%向上", "製造業ノウハウ転用", "IoT×生成AI"],
      "business_insight": "製造業の予知保全技術が不動産管理に越境。業界の壁が溶け始めている典型例。コンサルの業界横断提案力が試される。",
      "sentiment": "positive",
      "impact_level": "high",
      "status": "insight_added"
    },
    {
      "id": "NEWS-0008",
      "title": "中小建設会社のM&A、2025年度は過去最多ペース",
      "source_name": "M&A Online",
      "published_at": "2026-03-15",
      "collected_at": "2026-03-15T09:00:00.000Z",
      "industries": ["construction", "consulting"],
      "theme_tags": ["ma", "labor_shortage"],
      "summary": "中小建設会社のM&Aが急増。後継者不足と2024年問題への対応力不足が主因。PMI支援のコンサルティング需要も拡大。",
      "key_facts": ["過去最多ペース", "後継者不足", "PMI支援需要拡大"],
      "business_insight": "建設業M&Aの加速は業界再編の始まり。PMI×DXのセット提案がコンサルの新たな収益源になる。",
      "sentiment": "mixed",
      "impact_level": "high",
      "status": "insight_added"
    },
    {
      "id": "NEWS-0009",
      "title": "製造業の生成AI導入率、大企業45%・中小企業8%と格差拡大",
      "source_name": "日刊工業新聞",
      "published_at": "2026-03-24",
      "collected_at": "2026-03-24T10:00:00.000Z",
      "industries": ["manufacturing", "ai"],
      "theme_tags": ["generative_ai", "dx", "skills_talent"],
      "summary": "製造業における生成AI導入率調査。大企業と中小企業の格差が鮮明に。導入障壁は「何に使えるかわからない」が最多回答。",
      "key_facts": ["大企業45%", "中小企業8%", "導入障壁は用途不明"],
      "business_insight": "中小製造業の生成AI導入支援は巨大な潜在市場。「何に使えるか」を具体的に示すコンサルティングが必要。",
      "sentiment": "mixed",
      "impact_level": "medium",
      "status": "insight_added"
    },
    {
      "id": "NEWS-0010",
      "title": "不動産大手、サステナブル建築の認証取得を2030年までに全保有物件へ",
      "source_name": "住宅新報",
      "published_at": "2026-03-19",
      "collected_at": "2026-03-19T13:00:00.000Z",
      "industries": ["real_estate", "construction"],
      "theme_tags": ["sustainability", "regulation", "investment"],
      "summary": "不動産大手3社がサステナブル建築認証（ZEB/ZEH）の全物件取得を宣言。建設コスト増は不可避だが、ESG投資呼び込みで相殺する戦略。",
      "key_facts": ["2030年全物件", "ZEB/ZEH認証", "3社宣言"],
      "sentiment": "positive",
      "impact_level": "medium",
      "status": "analyzed"
    },
    {
      "id": "NEWS-0011",
      "title": "AIエージェント活用、コンサルファームの業務効率が3倍に",
      "source_name": "ITmedia",
      "published_at": "2026-03-29",
      "collected_at": "2026-03-29T08:00:00.000Z",
      "industries": ["consulting", "ai"],
      "theme_tags": ["generative_ai", "automation", "skills_talent"],
      "summary": "大手コンサルティングファームがAIエージェントを全社導入。リサーチ・資料作成・データ分析の工数が平均3分の1に。一方でジュニアコンサルの育成方法に課題。",
      "key_facts": ["業務効率3倍", "全社導入", "ジュニア育成に課題"],
      "business_insight": "AIエージェントはコンサルの生産性を劇的に変えるが、「考える力」の育成という新たな課題を生む。教育体系の再設計が急務。",
      "sentiment": "mixed",
      "impact_level": "high",
      "status": "insight_added"
    },
    {
      "id": "NEWS-0012",
      "title": "建設×製造のロボティクス連携、現場作業の自動化実証が拡大",
      "source_name": "ロボット ダイジェスト",
      "published_at": "2026-03-23",
      "collected_at": "2026-03-23T12:00:00.000Z",
      "industries": ["construction", "manufacturing"],
      "theme_tags": ["automation", "dx", "labor_shortage"],
      "summary": "製造業で培われた産業用ロボット技術を建設現場に応用する実証実験が拡大。溶接・墨出し・搬送の3領域で成果。ロボットメーカーが建設市場に本格参入。",
      "key_facts": ["3領域で実証成果", "ロボットメーカー参入", "製造→建設の技術移転"],
      "business_insight": "製造業のロボティクスが建設業に越境する動きが本格化。業界の壁を越えた技術移転が加速している。",
      "sentiment": "positive",
      "impact_level": "medium",
      "status": "insight_added"
    }
  ]
}
